{
  "$schema":"https://json-schema.org/draft/2020-12/schema",
  "$id":"vss.resource.production_visual_grounding_profile/1",
  "type":"object",
  "additionalProperties":false,
  "required":["schema_version","contract_identity","contract_version","profile_id","revision","scope","applicability","mode","groups","uncertainty","conflicts","limitations","evidence_references","lifecycle","reviewer_accountability_id","profile_sha256"],
  "properties":{
    "schema_version":{"const":"1"},
    "contract_identity":{"const":"production_visual_grounding_profile"},
    "contract_version":{"const":"1"},
    "profile_id":{"type":"string","pattern":"^visual-grounding-[a-z0-9][a-z0-9._-]{0,63}$"},
    "revision":{"type":"integer","minimum":1,"maximum":2147483647},
    "scope":{"$ref":"#/$defs/scope"},
    "applicability":{"$ref":"#/$defs/applicability"},
    "mode":{"enum":["not_required","required"]},
    "groups":{"type":"array","maxItems":16,"items":{"$ref":"#/$defs/group"}},
    "uncertainty":{"type":"array","maxItems":16,"uniqueItems":true,"items":{"$ref":"#/$defs/text"}},
    "conflicts":{"type":"array","maxItems":16,"uniqueItems":true,"items":{"$ref":"#/$defs/text"}},
    "limitations":{"type":"array","minItems":1,"maxItems":16,"uniqueItems":true,"items":{"$ref":"#/$defs/text"}},
    "evidence_references":{"type":"array","maxItems":32,"uniqueItems":true,"items":{"$ref":"#/$defs/id"}},
    "lifecycle":{"enum":["active","revoked"]},
    "reviewer_accountability_id":{"$ref":"#/$defs/accountability"},
    "profile_sha256":{"$ref":"#/$defs/digest"}
  },
  "allOf":[
    {"if":{"properties":{"mode":{"const":"not_required"}}},"then":{"properties":{"groups":{"maxItems":0}}}},
    {"if":{"properties":{"mode":{"const":"required"}}},"then":{"properties":{"groups":{"minItems":1}}}}
  ],
  "$defs":{
    "id":{"type":"string","minLength":3,"maxLength":128,"pattern":"^[a-z][a-z0-9._:-]*$"},
    "accountability":{"type":"string","minLength":1,"maxLength":128,"pattern":"^[A-Za-z0-9][A-Za-z0-9_.@/-]*$"},
    "digest":{"type":"string","pattern":"^[0-9a-f]{64}$"},
    "text":{"type":"string","minLength":1,"maxLength":1024},
    "scope":{"type":"object","additionalProperties":false,"required":["tenant_id","universe_id","production_id"],"properties":{"tenant_id":{"$ref":"#/$defs/id"},"universe_id":{"$ref":"#/$defs/id"},"production_id":{"$ref":"#/$defs/id"}}},
    "applicability":{"type":"object","additionalProperties":false,"required":["scene_ids","character_ids"],"properties":{"scene_ids":{"type":"array","maxItems":32,"uniqueItems":true,"items":{"$ref":"#/$defs/id"}},"character_ids":{"type":"array","maxItems":32,"uniqueItems":true,"items":{"$ref":"#/$defs/id"}}}},
    "group":{"type":"object","additionalProperties":false,"required":["ordinal","group_id","positive_constraints","negative_constraints","explicit_unknowns","limitations","source_reference_digests"],"properties":{"ordinal":{"type":"integer","minimum":1,"maximum":16},"group_id":{"$ref":"#/$defs/id"},"positive_constraints":{"type":"array","minItems":1,"maxItems":16,"uniqueItems":true,"items":{"$ref":"#/$defs/text"}},"negative_constraints":{"type":"array","minItems":1,"maxItems":16,"uniqueItems":true,"items":{"$ref":"#/$defs/text"}},"explicit_unknowns":{"type":"array","maxItems":16,"uniqueItems":true,"items":{"$ref":"#/$defs/text"}},"limitations":{"type":"array","minItems":1,"maxItems":16,"uniqueItems":true,"items":{"$ref":"#/$defs/text"}},"source_reference_digests":{"type":"array","minItems":1,"maxItems":16,"uniqueItems":true,"items":{"$ref":"#/$defs/digest"}}}}
  }
}
